com.axionenergy.on,41,0.41,es,merlinnfc,2023-03-14T13:48:36Z,1.6788E+12,2023-03-14T13:48:36Z,1.6788E+12,1,,"Pésima! Primero que tenés que crearte un usuario cuando hoy en día está disponible la asociación a alguna cuenta existente(Google, Facebook,etc). Al margen de eso, quise hacer el usuario y ya existía. Reseteé 3 veces la contraseña y en las 3 me dice que es invalida cuando antes permite el cambio. Revisen urgente porque van a recibir más calificaciones cómo estás, una pena. Espero le sirva, corrijan y avisen. Suerte!",2023-04-06T19:38:33Z,1.68081E+12,"Hola Nicolas de Mena, agradecemos tu mensaje, estamos trabajando en mejorar la experiencia de usuario en nuestra app, próximamente incorporaremos el reconocimiento facial. Por favor llamanos al 0800-888-0282 para ayudarte con tu registro. ¡Gracias! ",http://play.google.com/console/developers/4990580764130084460/app/4975284850460070403/user-feedback/review-details?reviewId=e2d75525-6e6b-48ad-8db7-82d9ed0f2085&corpus=PUBLIC_REVIEWS
com.axionenergy.on,,,es,r8s,2023-03-14T14:28:54Z,1.6788E+12,2023-03-14T14:28:54Z,1.6788E+12,5,,,,,,
com.axionenergy.on,41,0.41,es,dubai,2023-03-14T14:55:11Z,1.67881E+12,2023-03-14T14:55:11Z,1.67881E+12,1,,"No anda, no carga la aplicación",2023-04-06T19:39:37Z,1.68081E+12,"Hola javier, agradecemos tu mensaje, estamos trabajando en mejorar la experiencia de usuario en nuestra app. Por favor llamanos al 0800-888-0282 para ayudarte a resolverlo. ¡Gracias! ",http://play.google.com/console/developers/4990580764130084460/app/4975284850460070403/user-feedback/review-details?reviewId=dcb4d051-e591-4f9b-a961-01d6eee851a5&corpus=PUBLIC_REVIEWS
com.axionenergy.on,41,0.41,en,g0q,2023-03-14T15:04:17Z,1.67881E+12,2023-03-14T15:04:17Z,1.67881E+12,1,,"No anda, da error 502",2023-04-06T19:40:01Z,1.68081E+12,"Hola German, agradecemos tu mensaje, estamos trabajando en mejorar la experiencia de usuario en nuestra app. Por favor llamanos al 0800-888-0282 para ayudarte a resolverlo. ¡Gracias! ",http://play.google.com/console/developers/4990580764130084460/app/4975284850460070403/user-feedback/review-details?reviewId=7d8a00b4-3f9b-4fb8-8e28-b9ccb1bbc253&corpus=PUBLIC_REVIEWS
com.axionenergy.on,41,0.41,es,hawaiip,2023-03-15T00:11:44Z,1.67884E+12,2023-03-15T00:11:44Z,1.67884E+12,1,,Muchos errores al ingresar,2023-04-06T19:41:29Z,1.68081E+12,"Hola Martin Ivan Martinez, agradecemos tu mensaje, estamos trabajando en mejorar la experiencia de usuario en nuestra app. Tendremos en cuenta tu comentario y esperamos que nos sigas acompañando. ¡Gracias! ",http://play.google.com/console/developers/4990580764130084460/app/4975284850460070403/user-feedback/review-details?reviewId=b5c05229-27a2-41b6-8c7b-7e34f135da96&corpus=PUBLIC_REVIEWS
com.axionenergy.on,,,es,davinci,2023-03-15T11:58:20Z,1.67888E+12,2023-03-15T11:58:20Z,1.67888E+12,1,,"No te deja crear la cuenta, cuándo terminás de cargar los datos genera un error",2023-04-06T19:43:52Z,1.68081E+12,"Hola Daniel Grand, agradecemos tu mensaje, estamos trabajando en mejorar la experiencia de usuario en nuestra app. Por favor llamanos al 0800-888-0282 para ayudarte con tu registro. ¡Gracias! ",http://play.google.com/console/developers/4990580764130084460/app/4975284850460070403/user-feedback/review-details?reviewId=e061a4cf-2cb0-4e12-bedc-0d32e3d88f75&corpus=PUBLIC_REVIEWS
com.axionenergy.on,41,0.41,es,r9s,2023-03-15T14:06:39Z,1.67889E+12,2023-03-15T14:06:39Z,1.67889E+12,5,,,,,,
com.axionenergy.on,41,0.41,es,lavender,2023-03-15T14:43:42Z,1.67889E+12,2023-03-15T14:43:42Z,1.67889E+12,5,,Todo OK,2023-04-06T19:44:15Z,1.68081E+12,"Hola daniel german onega, agradecemos tu mensaje, esperamos que disfrutes de todos los beneficios y descuentos que tenemos para vos, están geolocalizados para que los puedas usar dependiendo en qué parte del país te encuentres. ¡Gracias! ",http://play.google.com/console/developers/4990580764130084460/app/4975284850460070403/user-feedback/review-details?reviewId=e6b8defb-0b7a-404c-8474-7557d14dce35&corpus=PUBLIC_REVIEWS
com.axionenergy.on,,,es,eqs,2023-03-15T15:28:14Z,1.67889E+12,2023-03-15T15:28:14Z,1.67889E+12,1,,"Muy mala la aplicación, ya de entrada para poner la fecha de nacimiento es un dolor de huevos. Mal diseñada, poco práctica , se traba, los beneficios para los clientes son malos. De lo peor .",2023-04-06T19:44:58Z,1.68081E+12,"Hola Emiliano Hueller, agradecemos tu mensaje, estamos trabajando en mejorar la experiencia de usuario en nuestra app. Tendremos en cuenta tu comentario y esperamos que nos sigas acompañando. ¡Gracias! ",http://play.google.com/console/developers/4990580764130084460/app/4975284850460070403/user-feedback/review-details?reviewId=6657df82-d1f0-475b-949c-2e6a98419f0a&corpus=PUBLIC_REVIEWS
com.axionenergy.on,,,es,c2s,2023-03-15T17:57:22Z,1.6789E+12,2023-03-15T17:57:22Z,1.6789E+12,1,,"Interpreto una falla en el desarrollo de la App, ya que refiere Dni ya existente y no me permite registrarme .",2023-04-06T19:45:25Z,1.68081E+12,"Hola Anibal G, agradecemos tu mensaje, estamos trabajando en mejorar la experiencia de usuario en nuestra app. Por favor llamanos al 0800-888-0282 para ayudarte a resolverlo. ¡Gracias! ",http://play.google.com/console/developers/4990580764130084460/app/4975284850460070403/user-feedback/review-details?reviewId=8e5e4e79-bf89-4296-b514-44d35361d2be&corpus=PUBLIC_REVIEWS
com.axionenergy.on,41,0.41,es,lavender,2023-03-15T21:59:32Z,1.67892E+12,2023-03-15T21:59:32Z,1.67892E+12,1,,"Una mentira. Cuando vas a usar el cupón de primer carga, te dice que necesitas otro codigo y apenas salís el cupón ya deja de estar disponible. Cargué igual el tanque lleno y no hay forma de que la app te cuente la carga para acumular descuentos.",2023-04-06T19:46:23Z,1.68081E+12,"Hola Celeste Caruso, agradecemos tu mensaje, estamos trabajando en mejorar la experiencia de usuario en nuestra app. Por favor verificá si el descuento de Bienvenida te quedó guardado en Mis Cupones y sino llamanos al 0800-888-0282 para ayudarte a resolverlo. ¡Gracias! ",http://play.google.com/console/developers/4990580764130084460/app/4975284850460070403/user-feedback/review-details?reviewId=2cd872fb-6584-4fc6-ab56-ce0bb5a71bc9&corpus=PUBLIC_REVIEWS
com.axionenergy.on,,,es,a03,2023-03-16T00:38:20Z,1.67893E+12,2023-03-16T00:38:20Z,1.67893E+12,5,,,,,,
com.axionenergy.on,41,0.41,es,dm3q,2023-03-16T03:08:51Z,1.67894E+12,2023-03-16T03:08:51Z,1.67894E+12,1,,Error de servidor al crear el usuario.,2023-04-06T19:46:45Z,1.68081E+12,"Hola Sebas S, agradecemos tu mensaje, estamos trabajando en mejorar la experiencia de usuario en nuestra app. Por favor llamanos al 0800-888-0282 para ayudarte a resolverlo. ¡Gracias! ",http://play.google.com/console/developers/4990580764130084460/app/4975284850460070403/user-feedback/review-details?reviewId=5c9a081c-c4ec-4c29-9ec8-9ee48bf7f6c4&corpus=PUBLIC_REVIEWS
com.axionenergy.on,41,0.41,es,a20s,2023-03-16T03:14:33Z,1.67894E+12,2023-03-16T03:14:33Z,1.67894E+12,1,,"No sirve cargas todos los datos para crear la cuenta y te dice que ya hay una cuenta con ese DNI ,correo electronico,malisima",2023-04-06T19:47:43Z,1.68081E+12,"Hola esteban nicolas Cervero, agradecemos tu mensaje, estamos trabajando en mejorar la experiencia de usuario en nuestra app. Por favor llamanos al 0800-888-0282 para ayudarte a resolverlo. ¡Gracias! ",http://play.google.com/console/developers/4990580764130084460/app/4975284850460070403/user-feedback/review-details?reviewId=2deea49b-0f8a-4eaa-b9b8-e8d23aca5ec0&corpus=PUBLIC_REVIEWS
com.axionenergy.on,41,0.41,es,rhodep,2023-03-16T13:29:46Z,1.67897E+12,2023-03-16T13:29:46Z,1.67897E+12,1,,"Te da error al ingresar, si ya creaste un usuario y cambiaste de mail es imposible modificar la clave",2023-04-06T19:48:25Z,1.68081E+12,"Hola Hernando Enrriquez, agradecemos tu mensaje, estamos trabajando en mejorar la experiencia de usuario en nuestra app. Por favor llamanos al 0800-888-0282 para ayudarte a resolverlo. ¡Gracias! ",http://play.google.com/console/developers/4990580764130084460/app/4975284850460070403/user-feedback/review-details?reviewId=5ac90ab6-030c-4d6a-a561-135e4f2a875e&corpus=PUBLIC_REVIEWS
com.axionenergy.on,,,es,Tokyo_Lite,2023-03-16T14:35:51Z,1.67898E+12,2023-03-16T14:35:51Z,1.67898E+12,1,,"Aplicación solo para niños y jóvenes, no puede ser q para buscar la fecha de nacimientos uno este 2 horas pasando los años, dejen q uno escriba la fecha y listo, por eso no lo instale. Malisimo",2023-04-06T19:49:11Z,1.68081E+12,"Hola Daniela Canteros, agradecemos tu mensaje, estamos trabajando en mejorar la experiencia de usuario en nuestra app. Tendremos en cuenta tu comentario y esperamos que nos sigas acompañando. ¡Gracias! ",http://play.google.com/console/developers/4990580764130084460/app/4975284850460070403/user-feedback/review-details?reviewId=ab39b4fc-588b-4b4b-9b82-ae87679b722b&corpus=PUBLIC_REVIEWS
com.axionenergy.on,41,0.41,es,r0q,2023-03-16T18:24:55Z,1.67899E+12,2023-03-16T18:24:55Z,1.67899E+12,1,,"Anda pésimo. Cuando fui a cargar combustible no abría la app, por lo que no pude acreditar la compra ni aplicar el 15% de descuento por ser la 1er carga. Asimismo, la tuve que desinstalar y volver a instalar hasta que después de muchos intentos logré ingresar a la aplicación. Espero lo solucionen pronto, ya que soy cliente de Axion. Gracias.",2023-04-06T19:49:38Z,1.68081E+12,"Hola Gonzalo Barcelona, agradecemos tu mensaje, estamos trabajando en mejorar la experiencia de usuario en nuestra app. Podés aplicar el descuento del 15% en tu próxima carga ya que tiene una validez de 30 días. ¡Gracias! ",http://play.google.com/console/developers/4990580764130084460/app/4975284850460070403/user-feedback/review-details?reviewId=83a4a7bd-92dc-475d-ba39-24bdb1243dce&corpus=PUBLIC_REVIEWS
com.axionenergy.on,41,0.41,es,pstar,2023-03-16T18:45:30Z,1.67899E+12,2023-03-16T18:45:30Z,1.67899E+12,1,,"Falla la aplicación, cuando creas la cuenta te dice que el DNI ya se utilizó, me pasó a mi y dos personas más que conozco",2023-04-06T19:50:03Z,1.68081E+12,"Hola Paulo Martinez, agradecemos tu mensaje, estamos trabajando en mejorar la experiencia de usuario en nuestra app. Por favor llamanos al 0800-888-0282 para ayudarte a resolverlo. ¡Gracias! ",http://play.google.com/console/developers/4990580764130084460/app/4975284850460070403/user-feedback/review-details?reviewId=9bd68036-e231-46a3-86a6-5171a049452d&corpus=PUBLIC_REVIEWS
com.axionenergy.on,,,es,a01q,2023-03-16T20:07:13Z,1.679E+12,2023-03-16T20:07:13Z,1.679E+12,1,,Pesima no me deja registrarme la desinstale.,2023-04-06T19:50:28Z,1.68081E+12,"Hola Victor Manzanares, agradecemos tu mensaje, estamos trabajando en mejorar la experiencia de usuario en nuestra app. Por favor llamanos al 0800-888-0282 para ayudarte con tu registro. ¡Gracias! ",http://play.google.com/console/developers/4990580764130084460/app/4975284850460070403/user-feedback/review-details?reviewId=e2a21087-99bc-491a-aa82-bc909c9a0582&corpus=PUBLIC_REVIEWS
com.axionenergy.on,,,es,o1q,2023-03-16T22:35:49Z,1.67901E+12,2023-03-16T22:35:49Z,1.67901E+12,1,,"No anda, tenía mucha expectativa pero al final la borré. Me tira error en la base de datos de dynamics...sabrá Dios que significa. Slds.",2023-04-06T19:51:00Z,1.68081E+12,"Hola Maria Jose Solorzano, agradecemos tu mensaje, estamos trabajando en mejorar la experiencia de usuario en nuestra app. Esperamos nos des otra oportunidad, por favor llamanos al 0800-888-0282 para ayudarte a resolverlo, así podés disfrutar de todos los beneficios y descuentos que tenemos para vos. ¡Gracias! ",http://play.google.com/console/developers/4990580764130084460/app/4975284850460070403/user-feedback/review-details?reviewId=7dcf66cb-020f-4ecc-8acb-77ea8a8d01b3&corpus=PUBLIC_REVIEWS
com.axionenergy.on,41,0.41,es,vili,2023-03-16T23:25:07Z,1.67901E+12,2023-03-16T23:25:07Z,1.67901E+12,1,,"No sé.puede crear el usuario, muy mala",2023-04-06T19:51:26Z,1.68081E+12,"Hola Maria Maiz, agradecemos tu mensaje, estamos trabajando en mejorar la experiencia de usuario en nuestra app. Por favor llamanos al 0800-888-0282 para ayudarte a resolverlo. ¡Gracias! ",http://play.google.com/console/developers/4990580764130084460/app/4975284850460070403/user-feedback/review-details?reviewId=223c09e6-888c-4710-8c6f-b94c39824e56&corpus=PUBLIC_REVIEWS
com.axionenergy.on,41,0.41,es,HWPOT-H,2023-03-17T04:03:27Z,1.67903E+12,2023-03-17T04:03:27Z,1.67903E+12,1,,Una basura la aplicación. No te carga ningún beneficio. Funciona mejor desde el navegador,2023-04-06T19:52:01Z,1.68081E+12,"Hola gabriel Eynard, agradecemos tu mensaje, estamos trabajando en mejorar la experiencia de usuario en nuestra app. Tendremos en cuenta tu comentario y esperamos que nos sigas acompañando. ¡Gracias! ",http://play.google.com/console/developers/4990580764130084460/app/4975284850460070403/user-feedback/review-details?reviewId=71bb5b06-c2a2-49a7-978c-18daecb95735&corpus=PUBLIC_REVIEWS
com.axionenergy.on,41,0.41,es,mdh35lm,2023-03-17T11:17:25Z,1.67905E+12,2023-03-17T11:17:25Z,1.67905E+12,5,,Dice error cuando la creas pero salgan y entren a la aplicacion y esta creada dice error pero esta creada.,2023-04-06T19:53:14Z,1.68081E+12,"Hola Juan Gonzalez, agradecemos tu mensaje, estamos trabajando en mejorar la experiencia de usuario en nuestra app. Tendremos en cuenta tu comentario y esperamos que nos sigas acompañando. ¡Gracias! ",http://play.google.com/console/developers/4990580764130084460/app/4975284850460070403/user-feedback/review-details?reviewId=72f8cdd2-8bc5-47a6-acd6-e86c036daace&corpus=PUBLIC_REVIEWS
com.axionenergy.on,41,0.41,es,rhode,2023-03-17T11:40:32Z,1.67905E+12,2023-03-17T11:40:32Z,1.67905E+12,1,,Funciona muy mal,2023-04-06T19:54:04Z,1.68081E+12,"Hola Santiago Rodriguez, agradecemos tu mensaje, estamos trabajando en mejorar la experiencia de usuario en nuestra app. Tendremos en cuenta tu comentario y esperamos que nos sigas acompañando. ¡Gracias! ",http://play.google.com/console/developers/4990580764130084460/app/4975284850460070403/user-feedback/review-details?reviewId=389b0156-0fa3-483e-8fdf-bd39392cb7d5&corpus=PUBLIC_REVIEWS
com.axionenergy.on,41,0.41,es,astro,2023-03-17T11:47:25Z,1.67905E+12,2023-03-17T11:47:25Z,1.67905E+12,1,,"Tira error al crear cuenta, vamossss despiertense !!!!!",2023-04-06T19:54:21Z,1.68081E+12,"Hola A Rodriguez, agradecemos tu mensaje, estamos trabajando en mejorar la experiencia de usuario en nuestra app. Por favor llamanos al 0800-888-0282 para ayudarte con tu registro. ¡Gracias! ",http://play.google.com/console/developers/4990580764130084460/app/4975284850460070403/user-feedback/review-details?reviewId=6dc0ed0f-9cc3-4366-ba4c-d1079d707a9d&corpus=PUBLIC_REVIEWS
com.axionenergy.on,41,0.41,es,a12s,2023-03-17T13:00:08Z,1.67906E+12,2023-03-17T13:00:08Z,1.67906E+12,1,,Nadie chequea las app antes de lanzar las.? Desde hace dos días quiero crear la cuenta y me dice UPS ALGO SALIO MAL . POCO SERIO,2023-04-06T19:54:41Z,1.68081E+12,"Hola Lucas, agradecemos tu mensaje, estamos trabajando en mejorar la experiencia de usuario en nuestra app. Por favor llamanos al 0800-888-0282 para ayudarte con tu registro. ¡Gracias! ",http://play.google.com/console/developers/4990580764130084460/app/4975284850460070403/user-feedback/review-details?reviewId=c3669e90-c608-41c6-9fba-024b61918fcc&corpus=PUBLIC_REVIEWS
com.axionenergy.on,41,0.41,es,rhode,2023-03-17T13:30:51Z,1.67906E+12,2023-03-17T13:30:51Z,1.67906E+12,1,,No puedo logerame. Imposible crear un usuario,2023-04-06T19:55:16Z,1.68081E+12,"Hola Javier Jurado, agradecemos tu mensaje, estamos trabajando en mejorar la experiencia de usuario en nuestra app. Por favor llamanos al 0800-888-0282 para ayudarte a resolverlo. ¡Gracias! ",http://play.google.com/console/developers/4990580764130084460/app/4975284850460070403/user-feedback/review-details?reviewId=fcdebd94-84ab-44a0-acc0-3ec9a7ff2b91&corpus=PUBLIC_REVIEWS
com.axionenergy.on,41,0.41,es,hawaii,2023-03-17T13:40:22Z,1.67906E+12,2023-03-17T13:40:22Z,1.67906E+12,1,,"No permite registrarse. Salta ""¡UPS! Algo salió mal.",2023-04-06T19:55:49Z,1.68081E+12,"Hola José Enrique, agradecemos tu mensaje, estamos trabajando en mejorar la experiencia de usuario en nuestra app. Por favor llamanos al 0800-888-0282 para ayudarte con tu registro. ¡Gracias! ",http://play.google.com/console/developers/4990580764130084460/app/4975284850460070403/user-feedback/review-details?reviewId=fc32d681-cb88-4cf5-a19b-8f7b043ac68d&corpus=PUBLIC_REVIEWS
com.axionenergy.on,,,en,lake_n,2023-03-17T13:54:27Z,1.67906E+12,2023-03-17T13:54:27Z,1.67906E+12,1,,Error en la base de datos de dynamics 🤷🏻,2023-04-06T19:58:26Z,1.68081E+12,"Hola Argie dan, agradecemos tu mensaje, estamos trabajando en mejorar la experiencia de usuario en nuestra app. Por favor llamanos al 0800-888-0282 para ayudarte con tu registro. ¡Gracias! ",http://play.google.com/console/developers/4990580764130084460/app/4975284850460070403/user-feedback/review-details?reviewId=b54a045a-e104-490b-a6ef-fde3b8bf1fa3&corpus=PUBLIC_REVIEWS
com.axionenergy.on,41,0.41,en,,2023-03-17T14:31:29Z,1.67906E+12,2023-03-17T14:31:29Z,1.67906E+12,5,,,,,,
com.axionenergy.on,41,0.41,en,m12,2023-03-17T18:28:44Z,1.67908E+12,2023-03-17T18:28:44Z,1.67908E+12,1,,No muestra los beneficios.,2023-04-06T19:58:49Z,1.68081E+12,"Hola idsearch123, agradecemos tu mensaje, estamos trabajando en mejorar la experiencia de usuario en nuestra app. Por favor llamanos al 0800-888-0282 para ayudarte a resolverlo. ¡Gracias! ",http://play.google.com/console/developers/4990580764130084460/app/4975284850460070403/user-feedback/review-details?reviewId=192ab5d1-895b-44a8-8975-b9d33fe70711&corpus=PUBLIC_REVIEWS
com.axionenergy.on,,,es,b0q,2023-03-17T19:49:11Z,1.67908E+12,2023-03-17T19:49:11Z,1.67908E+12,1,,Ni siquiera me dejó crear la cuenta... pésima,2023-04-06T20:00:22Z,1.68081E+12,"Hola Carlos Gresta, agradecemos tu mensaje, estamos trabajando en mejorar la experiencia de usuario en nuestra app. Por favor llamanos al 0800-888-0282 para ayudarte a resolverlo. ¡Gracias! ",http://play.google.com/console/developers/4990580764130084460/app/4975284850460070403/user-feedback/review-details?reviewId=c8f6248a-f37a-41fd-8fa5-06fc44326920&corpus=PUBLIC_REVIEWS
com.axionenergy.on,41,0.41,es,a21s,2023-03-17T21:52:41Z,1.67909E+12,2023-03-17T22:02:07Z,1.67909E+12,1,,"No se puede instalar, algo no está bien en el software de ésta aplicación y por lo que se ve los programadores de AXION no se molestan en corregir, mejorar y actualizar. No tienen ganas de trabajar. MALA PROPAGANDA ESTA APLICACIÓN PARA AXION. Creí que AXION era más seria, competitiva.",2023-04-06T20:01:02Z,1.68081E+12,"Hola julio cesar MARTIN Apodo, agradecemos tu mensaje, estamos trabajando en mejorar la experiencia de usuario en nuestra app. Tenemos la app en su versión web o en sus versiones nativas para Android y para iOS. Por favor llamanos al 0800-888-0282 para ayudarte con la instalación. ¡Gracias! ",http://play.google.com/console/developers/4990580764130084460/app/4975284850460070403/user-feedback/review-details?reviewId=8eaa14c4-16f0-47c7-8d95-5b3d115379a0&corpus=PUBLIC_REVIEWS
com.axionenergy.on,41,0.41,es,a20,2023-03-17T23:01:58Z,1.67909E+12,2023-03-17T23:01:58Z,1.67909E+12,1,,Estoy intentando registrarme y no me deja me dice que la app no esta disponible.,2023-04-06T20:01:48Z,1.68081E+12,"Hola Guillermo Francisco Spanhake, agradecemos tu mensaje, estamos trabajando en mejorar la experiencia de usuario en nuestra app. Por favor llamanos al 0800-888-0282 para ayudarte con tu registro. ¡Gracias! ",http://play.google.com/console/developers/4990580764130084460/app/4975284850460070403/user-feedback/review-details?reviewId=6f0a721b-aa54-485d-ad44-13e5c7fd86af&corpus=PUBLIC_REVIEWS
com.axionenergy.on,41,0.41,es,y2s,2023-03-17T23:12:50Z,1.67909E+12,2023-03-17T23:12:50Z,1.67909E+12,1,,Tengo q retroceder 400 veces para encontrar el año de mi nacimiento....,2023-04-06T20:02:09Z,1.68081E+12,"Hola Federico Maschio, agradecemos tu mensaje, estamos trabajando en mejorar la experiencia de usuario en nuestra app. Tendremos en cuenta tu comentario y esperamos que nos sigas acompañando. ¡Gracias! ",http://play.google.com/console/developers/4990580764130084460/app/4975284850460070403/user-feedback/review-details?reviewId=cc1c9858-318a-4588-8b0d-fc942e3f1c57&corpus=PUBLIC_REVIEWS
com.axionenergy.on,41,0.41,es,doha,2023-03-18T01:47:28Z,1.6791E+12,2023-03-18T01:47:28Z,1.6791E+12,1,,Horrible!! Ya la desinstalo,2023-04-06T20:02:34Z,1.68081E+12,"Hola Fabiana Vera, agradecemos tu mensaje, estamos trabajando en mejorar la experiencia de usuario en nuestra app. Esperamos nos des otra oportunidad, por favor llamanos al 0800-888-0282 para entender cómo poder ayudarte. ¡Gracias! ",http://play.google.com/console/developers/4990580764130084460/app/4975284850460070403/user-feedback/review-details?reviewId=ac8e1aaa-dbce-46c3-b6e9-f860ca142237&corpus=PUBLIC_REVIEWS
com.axionenergy.on,41,0.41,es,a52q,2023-03-18T11:57:51Z,1.67914E+12,2023-03-18T11:57:51Z,1.67914E+12,2,,Internal error. No puedo registrarme,2023-04-06T20:02:55Z,1.68081E+12,"Hola Cristian Aramayo, agradecemos tu mensaje, estamos trabajando en mejorar la experiencia de usuario en nuestra app. Por favor llamanos al 0800-888-0282 para ayudarte con tu registro. ¡Gracias! ",http://play.google.com/console/developers/4990580764130084460/app/4975284850460070403/user-feedback/review-details?reviewId=e2ebca66-9b88-4cbf-b36a-dce31cb15f1e&corpus=PUBLIC_REVIEWS
com.axionenergy.on,41,0.41,es,beckham,2023-03-18T15:14:03Z,1.67915E+12,2023-03-18T15:14:03Z,1.67915E+12,1,,"Impractica, no pude registrarme porque no permite que ponga en números mí fecha de nacimiento, hay que usar el calendario",2023-04-06T20:13:03Z,1.68081E+12,"Hola Daniel Espinoza,agradecemos tu mensaje,estamos trabajando en mejorar la experiencia de usuario en nuestra app.Respecto a la fecha de nacimiento,podés hacer clic en el año y seleccionar el año de tu nacimiento sin tener que ir para atrás mes por mes.Por favor comunicate con nosotros al 0800-888-0282 para poder ayudarte con tu registro.Gracias ",http://play.google.com/console/developers/4990580764130084460/app/4975284850460070403/user-feedback/review-details?reviewId=87437ebd-5498-4563-b98d-b31e73572e4b&corpus=PUBLIC_REVIEWS
com.axionenergy.on,41,0.41,es,a52q,2023-03-18T18:13:16Z,1.67916E+12,2023-03-18T18:13:16Z,1.67916E+12,1,,"Cargo todos los datos, y a la hora de terminar el registro, me sale que tiene un problema con el servidor.",2023-04-06T20:13:30Z,1.68081E+12,"Hola Sergio Rufino, agradecemos tu mensaje, estamos trabajando en mejorar la experiencia de usuario en nuestra app. Por favor llamanos al 0800-888-0282 para ayudarte a resolverlo. ¡Gracias! ",http://play.google.com/console/developers/4990580764130084460/app/4975284850460070403/user-feedback/review-details?reviewId=e796bcef-9334-40c5-bc74-b8c24ba4e0b1&corpus=PUBLIC_REVIEWS
com.axionenergy.on,,,es,r8s,2023-03-18T20:03:23Z,1.67917E+12,2023-03-18T20:03:23Z,1.67917E+12,1,,"No pude crear la cuenta. ""Error interno de la aplicación"". (Conexión con el servidor). Para poner la fecha de nacimiento? Mes a mes. Increíble. Año 2023. Quien programó esto?",2023-04-06T20:14:25Z,1.68081E+12,"Hola Leandro Althabe,agradecemos tu mensaje,estamos trabajando en mejorar la experiencia de usuario en nuestra app.Respecto a la fecha de nacimiento,podés hacer clic en el año y seleccionar el año de tu nacimiento sin tener que ir para atrás mes por mes.Por favor comunicate con nosotros al 0800-888-0282 para poder ayudarte con tu registro.Gracias ",http://play.google.com/console/developers/4990580764130084460/app/4975284850460070403/user-feedback/review-details?reviewId=71055532-8270-4358-8359-500277ac2e56&corpus=PUBLIC_REVIEWS
com.axionenergy.on,41,0.41,es,beyond2,2023-03-18T23:41:34Z,1.67918E+12,2023-03-18T23:41:34Z,1.67918E+12,1,,"4 veces intenté registrarme y me figura error en el servidor. Hasta ahora, maso maso...deberían incorporar registrarse utilizando Facebook o Gmail.",2023-04-06T20:15:12Z,1.68081E+12,"Hola Leo Maiden, agradecemos tu mensaje, estamos trabajando en mejorar la experiencia de usuario en nuestra app, próximamente incorporaremos el reconocimiento facial. Por favor llamanos al 0800-888-0282 para ayudarte con tu registro. ¡Gracias! ",http://play.google.com/console/developers/4990580764130084460/app/4975284850460070403/user-feedback/review-details?reviewId=f2cdc813-42e4-4d48-8f84-7b2643327467&corpus=PUBLIC_REVIEWS
com.axionenergy.on,,,es,a32,2023-03-18T23:52:38Z,1.67918E+12,2023-03-18T23:52:38Z,1.67918E+12,1,,"No puedo ni loguearme, .me tira error 500 de servidor...la de ypf es más fácil.",2023-04-06T20:16:55Z,1.68081E+12,"Hola Mariano Caneda, agradecemos tu mensaje, estamos trabajando en mejorar la experiencia de usuario en nuestra app. Por favor llamanos al 0800-888-0282 para ayudarte a resolverlo. ¡Gracias! ",http://play.google.com/console/developers/4990580764130084460/app/4975284850460070403/user-feedback/review-details?reviewId=003a7a89-69ac-4762-853e-4a71f3428b4a&corpus=PUBLIC_REVIEWS
com.axionenergy.on,41,0.41,es,a12s,2023-03-19T00:05:50Z,1.67918E+12,2023-03-19T00:05:50Z,1.67918E+12,1,,"No se puede concretar la creación de la cuenta, sale un error del servidor de la aplicación...",2023-04-06T20:21:15Z,1.68081E+12,"Hola Eduardo Decarre, agradecemos tu mensaje, estamos trabajando en mejorar la experiencia de usuario en nuestra app. Por favor llamanos al 0800-888-0282 para ayudarte a resolverlo. ¡Gracias! ",http://play.google.com/console/developers/4990580764130084460/app/4975284850460070403/user-feedback/review-details?reviewId=405005b7-f088-44f9-99df-374f430a3c1d&corpus=PUBLIC_REVIEWS
