com.axionenergy.on,300,3,es,dh0lm,2023-05-04T20:01:56Z,1.68323E+12,2023-05-04T22:02:22Z,1.68324E+12,1,,"Una porqueria de App. *Mal diseñada. *No aclaran como mover cv (que sí se puede) La fecha de nacimiento hay que ponerla volviendo para atrás mes x mes... desde el día actual: 12 veces x año: Ejemplo: si tienes 70años debes teclear 12veces x cada año: 12x70= 840veces!! Además se cuelga la App. *No es facil registrar, todo complicado y se traba. Mejoren el programa.",2023-05-10T02:32:44Z,1.68369E+12,"Hola ROBERTO, agradecemos tu mensaje, estamos trabajando en mejorar la experiencia de usuario en nuestra app. Respecto a la fecha de nacimiento, podés hacer clic en el año y seleccionar el año de tu nacimiento sin tener que ir para atrás mes por mes. Por favor comunicate con nosotros al 0800-888-0282 para poder ayudarte con tu registro. ¡Gracias!",http://play.google.com/console/developers/4990580764130084460/app/4975284850460070403/user-feedback/review-details?reviewId=17c45874-7f01-414f-9f21-38e0fb55dcc0&corpus=PUBLIC_REVIEWS
com.axionenergy.on,300,3,es,potter_n,2023-05-05T00:13:28Z,1.68325E+12,2023-05-05T00:13:28Z,1.68325E+12,1,,"NO ANDA, FIN.",2023-05-10T02:33:14Z,1.68369E+12,"Hola Belen Ortiz, agradecemos tu mensaje, estamos trabajando en mejorar la experiencia de usuario en nuestra app. Por favor llamanos al 0800-888-0282 para ayudarte a resolverlo. ¡Gracias! ",http://play.google.com/console/developers/4990580764130084460/app/4975284850460070403/user-feedback/review-details?reviewId=13e7c631-d6dd-4655-8e8f-ba62ca0c3bf8&corpus=PUBLIC_REVIEWS
com.axionenergy.on,,,es,a22x,2023-05-05T01:02:35Z,1.68325E+12,2023-05-05T01:02:35Z,1.68325E+12,2,,"Muy tedioso el proceso de registro. Para poner fecha hay una sola forma, pasando mes a mes... terrible , 😔 🚱",2023-05-10T02:33:52Z,1.68369E+12,"Hola Danalf, agradecemos tu mensaje, estamos trabajando en mejorar la experiencia de usuario en nuestra app. Respecto a la fecha de nacimiento, podés hacer clic en el año y seleccionar el año de tu nacimiento sin tener que ir para atrás mes por mes. Por favor comunicate con nosotros al 0800-888-0282 para poder ayudarte con tu registro. ¡Gracias! ",http://play.google.com/console/developers/4990580764130084460/app/4975284850460070403/user-feedback/review-details?reviewId=c70a847b-a2e7-40d0-9189-dadc795cfa2d&corpus=PUBLIC_REVIEWS
com.axionenergy.on,,,es,a10,2023-05-05T01:04:36Z,1.68325E+12,2023-05-05T01:04:36Z,1.68325E+12,5,,,,,,
com.axionenergy.on,300,3,es,def,2023-05-05T01:58:17Z,1.68325E+12,2023-05-05T01:58:17Z,1.68325E+12,5,,,,,,
com.axionenergy.on,,,es,sanders_n,2023-05-05T16:26:49Z,1.6833E+12,2023-05-05T16:26:49Z,1.6833E+12,1,,No puede ingresar,2023-05-10T02:34:47Z,1.68369E+12,"Hola Marita Franchino, agradecemos tu mensaje, estamos trabajando en mejorar la experiencia de usuario en nuestra app. Por favor llamanos al 0800-888-0282 para ayudarte a resolverlo. ¡Gracias! ",http://play.google.com/console/developers/4990580764130084460/app/4975284850460070403/user-feedback/review-details?reviewId=b24b1e2d-147b-4e04-b6a5-275c752d8e3f&corpus=PUBLIC_REVIEWS
com.axionenergy.on,300,3,es,a13,2023-05-05T23:34:39Z,1.68333E+12,2023-05-05T23:34:39Z,1.68333E+12,1,,No puedo usar mi gmail al crearme una cuenta ya que dice que es un email invalido.,2023-05-10T02:35:09Z,1.68369E+12,"Hola Ezequiel Portel, agradecemos tu mensaje, estamos trabajando en mejorar la experiencia de usuario en nuestra app. Por favor llamanos al 0800-888-0282 para ayudarte a resolverlo. ¡Gracias! ",http://play.google.com/console/developers/4990580764130084460/app/4975284850460070403/user-feedback/review-details?reviewId=e7420568-1f76-4242-ab19-d6936e283ec4&corpus=PUBLIC_REVIEWS
com.axionenergy.on,300,3,es,fijisc,2023-05-06T00:33:12Z,1.68333E+12,2023-05-06T00:33:12Z,1.68333E+12,2,,"Uhhh espero que te hayan nacido en 1982, se van a cansar de apretar la flecha para llegar a la fecha!!! Apretando el año no se puede elegir el mismo como dice el programador",2023-05-10T02:35:33Z,1.68369E+12,"Hola Matias, agradecemos tu mensaje, estamos trabajando en mejorar la experiencia de usuario en nuestra app. Respecto a la fecha de nacimiento, podés hacer clic en el año y seleccionar el año de tu nacimiento sin tener que ir para atrás mes por mes. Por favor comunicate con nosotros al 0800-888-0282 para poder ayudarte con tu registro. ¡Gracias! ",http://play.google.com/console/developers/4990580764130084460/app/4975284850460070403/user-feedback/review-details?reviewId=8926e462-e059-417c-9e28-8c90c2fc37fc&corpus=PUBLIC_REVIEWS
com.axionenergy.on,300,3,es,cyprus64,2023-05-06T15:04:36Z,1.68339E+12,2023-05-06T15:04:36Z,1.68339E+12,5,,Muy buena,2023-05-10T02:35:53Z,1.68369E+12,"Hola miguel angel ruiz naranjo (Constructora), agradecemos tu mensaje, qué bueno que te haya gustado la app, hay muchos beneficios y están geolocalizados para que disfrutarlos dependiendo en qué parte del país te encuentres. ¡Gracias! ",http://play.google.com/console/developers/4990580764130084460/app/4975284850460070403/user-feedback/review-details?reviewId=17638c42-7cb1-41d5-9cae-b49f67e8f925&corpus=PUBLIC_REVIEWS
com.axionenergy.on,,,es,a31,2023-05-06T15:07:23Z,1.68339E+12,2023-05-06T15:07:23Z,1.68339E+12,2,,Le doy 2 estrellas porque tendría Q quedar iniciado para entrar o si no la usas seguido te deje entrar con la huella como todo se usa con huella y para hacer mas rápido el pago o Q te sume los puntos tener un Qr los chicos pierden mucho tiempo también que te cargan los puntos y si no demoran con la tarjeta de crédito cuando cambien eso le subo las estrellas,2023-05-10T02:36:43Z,1.68369E+12,"Hola Walter Damian Leguizamon, agradecemos tu mensaje, estamos trabajando en mejorar la experiencia de usuario en nuestra app, próximamente incorporaremos el reconocimiento facial. ¡Gracias!",http://play.google.com/console/developers/4990580764130084460/app/4975284850460070403/user-feedback/review-details?reviewId=60dc7d36-43db-4c55-b791-9bd67c0296fd&corpus=PUBLIC_REVIEWS
com.axionenergy.on,300,3,es,dubai,2023-05-06T15:22:59Z,1.68339E+12,2023-05-06T15:22:59Z,1.68339E+12,1,,"Muy lenta, para ingresar la fecha de nacimiento tenés que ir para atrás mes por mes desde la fecha del día que te estás registrando, es mejor dejarlo sin calendario y que se tipee la fecha de nacimiento. Espero lo puedan cambiar para los nuevos que se registran. Saludos.",2023-05-10T02:37:43Z,1.68369E+12,"Hola Gabriela, agradecemos tu mensaje, estamos trabajando en mejorar la experiencia de usuario en nuestra app. Respecto a la fecha de nacimiento, podés hacer clic en el año y seleccionar el año de tu nacimiento sin tener que ir para atrás mes por mes. Por favor comunicate con nosotros al 0800-888-0282 para poder ayudarte con tu registro. ¡Gracias!",http://play.google.com/console/developers/4990580764130084460/app/4975284850460070403/user-feedback/review-details?reviewId=9f8f0f17-87f4-4db3-a1ce-471c6a6ac347&corpus=PUBLIC_REVIEWS
com.axionenergy.on,,,en,a22,2023-05-06T21:53:09Z,1.68341E+12,2023-05-06T21:53:09Z,1.68341E+12,5,,,,,,
com.axionenergy.on,300,3,es,p3s,2023-05-07T03:50:17Z,1.68343E+12,2023-05-07T03:52:39Z,1.68343E+12,1,,"Podrían poner el ingreso x huella... la verdad q rompe mucho las.... poner el dni y la contraseña cada vez q tenés q ingresara la app! Y quien fue el HDP q para poner el año d nacimiento tenes q ir para atrás en el calendario... 42 años, retrocediendo mes x mes!!! Son un desastre! Como haría Mirtha para llegar a su fecha d nacimiento???",2023-05-10T02:39:04Z,1.68369E+12,"Hola Jerónimo, agradecemos tu mensaje, estamos trabajando en mejorar la experiencia de usuario en nuestra app, próximamente incorporaremos el reconocimiento facial. ¡Gracias!",http://play.google.com/console/developers/4990580764130084460/app/4975284850460070403/user-feedback/review-details?reviewId=944ea3d4-9f01-414e-a00f-fb9ac2caf3ad&corpus=PUBLIC_REVIEWS
com.axionenergy.on,300,3,en,tab0024c,2023-05-07T20:57:29Z,1.68349E+12,2023-05-07T20:57:29Z,1.68349E+12,4,,,,,,
com.axionenergy.on,300,3,es,lavender,2023-05-08T01:19:00Z,1.68351E+12,2023-05-08T01:19:00Z,1.68351E+12,2,,"Pongo baja puntuación porque 1) siempre tenés que ingresar, no queda abierta la sesión y 2) hay descuentos pero en Quantium. Los que si o sí necesitamos Super no tenemos tantos beneficios.",2023-05-10T02:40:00Z,1.68369E+12,"Hola Lu, agradecemos tu mensaje, estamos trabajando en mejorar la experiencia de usuario en nuestra app, próximamente incorporaremos el reconocimiento facial. ¡Gracias!",http://play.google.com/console/developers/4990580764130084460/app/4975284850460070403/user-feedback/review-details?reviewId=5f63e345-b273-4099-9cb5-287ddef85557&corpus=PUBLIC_REVIEWS
com.axionenergy.on,300,3,es,Odin,2023-05-08T14:21:48Z,1.68356E+12,2023-05-08T14:21:48Z,1.68356E+12,5,,Maravillosa app,2023-05-10T02:40:17Z,1.68369E+12,"Hola agustín martínez, agradecemos tu mensaje, qué bueno que te haya gustado la app, hay muchos beneficios y están geolocalizados para que disfrutarlos dependiendo en qué parte del país te encuentres. ¡Gracias! ",http://play.google.com/console/developers/4990580764130084460/app/4975284850460070403/user-feedback/review-details?reviewId=69239c8e-fe9a-400f-bb92-5c3fc13d186b&corpus=PUBLIC_REVIEWS
com.axionenergy.on,300,3,es,,2023-05-08T22:34:11Z,1.68359E+12,2023-05-08T22:34:11Z,1.68359E+12,4,,¿Que días se puede hacer el canje de 15% de descuento en la primer carga?,2023-05-10T02:41:48Z,1.68369E+12,"Hola Silvina M, agradecemos tu mensaje, estamos trabajando en mejorar la experiencia de usuario en nuestra app. El descuento de Bienvenida una vez canjeado podes utilizarlo cualquier día, solo tene en cuenta que tiene vigencia de 30 días desde que lo solicitas. Cualquier duda llamanos al 0800-888-0282 para ayudarte. ¡Gracias! ",http://play.google.com/console/developers/4990580764130084460/app/4975284850460070403/user-feedback/review-details?reviewId=0b39319b-f962-4f26-a55d-86b34fddac89&corpus=PUBLIC_REVIEWS
com.axionenergy.on,300,3,es,j7xelte,2023-05-08T22:52:29Z,1.68359E+12,2023-05-08T22:52:29Z,1.68359E+12,5,,,,,,
com.axionenergy.on,200,2,es,a20,2023-05-08T23:11:20Z,1.68359E+12,2023-05-08T23:11:20Z,1.68359E+12,1,,"Me molesta la cantidad de veces que pide actualizar la app y que la misma sea obligatoria, luego de hacerlo no veo ningún cambio que lo justifique.",2023-05-10T02:43:30Z,1.68369E+12,"Hola Fabio Ledesma, agradecemos tu mensaje, estamos trabajando en mejorar la experiencia de usuario en nuestra app por esa razón estamos generando actualizaciones seguido. Tendremos en cuenta tu comentario y esperamos que nos sigas acompañando. ¡Gracias!",http://play.google.com/console/developers/4990580764130084460/app/4975284850460070403/user-feedback/review-details?reviewId=a6448447-3ffa-4519-8e7f-93e2c5f4bc06&corpus=PUBLIC_REVIEWS
com.axionenergy.on,300,3,es,guamp,2023-05-08T23:30:43Z,1.68359E+12,2023-05-08T23:30:43Z,1.68359E+12,5,,,,,,
com.axionenergy.on,300,3,es,dreamlte,2023-05-09T18:25:59Z,1.68366E+12,2023-05-09T18:25:59Z,1.68366E+12,1,,"LO MÁS IMPORTANTE ES QUE ANTES USABA EL BENEFICIO DE CLARÍN 365 PARA EL DESCUENTO EN ""NAFTA SUPER"" Y YA NO ESTÁ MÁS SOLO EN QUANTUM, Y PARA LOS USUARIOS DE SUPER ES UNA DECEPCIÓN, PARA Q TE DESCUENTEN EL 10% EN SUPER AHORA TENÉS Q CARGAR 5 VECES PARA RECIÉN TENER EL DESCUENTO, SOLO UTILICÉ HOY EL DESCUENTO DEL 15% Q TE DAN POR ÚNICA VEZ, UNA LÁSTIMA PERDIERON OTRO CLIENTE, VOY A CARGAR EN YPF Q LA SUPER CUESTA MÁS BARATA Y TE HACEN DESCUENTO, COMO VAN A QUITAR EL BENEFICIO PARA LA NAFTA SUPER!!",2023-05-10T02:44:20Z,1.68369E+12,"Hola Sebastian Perroni, agradecemos tu mensaje, estamos trabajando en mejorar la experiencia de usuario en nuestra app. Tendremos en cuenta tu comentario y esperamos que nos sigas acompañando. ¡Gracias! ",http://play.google.com/console/developers/4990580764130084460/app/4975284850460070403/user-feedback/review-details?reviewId=96169e81-2448-4d7f-96bc-92c6e019e21b&corpus=PUBLIC_REVIEWS
com.axionenergy.on,300,3,es,a52q,2023-05-09T22:53:56Z,1.68367E+12,2023-05-09T22:53:56Z,1.68367E+12,1,,"LA INSTALÉ A PESAR DE LOS COMENTARIOS, PERO SON CIERTOS. INTERFAZ POCO INTUITIVA. INFO CONFUSA. NO PUEDO USAR HUELLAS DIGITAL... ETC ETC",2023-05-10T02:45:08Z,1.68369E+12,"Hola CARL IPHONE, agradecemos tu mensaje, estamos trabajando en mejorar la experiencia de usuario en nuestra app, próximamente incorporaremos el reconocimiento facial. Tendremos en cuenta tu comentario y esperamos que nos sigas acompañando. ¡Gracias! ",http://play.google.com/console/developers/4990580764130084460/app/4975284850460070403/user-feedback/review-details?reviewId=b9c021b8-bf33-4ab2-99da-08c716725002&corpus=PUBLIC_REVIEWS
com.axionenergy.on,300,3,es,on5xelte,2023-05-07T15:46:21Z,1.68347E+12,2023-05-10T02:47:54Z,1.68369E+12,2,,"No me deja pasar del DNI, y la instalé y desinstalé varias veces... Hoy 09/05/2023 ya la instalé y realicé mi primer carga, 15% de descuento al toque, estaría bueno que sea billetera virtual. Pero hoy funciona D10",2023-05-10T02:39:24Z,1.68369E+12,"Hola Sebastian Cazamayor, agradecemos tu mensaje, estamos trabajando en mejorar la experiencia de usuario en nuestra app. Por favor llamanos al 0800-888-0282 para ayudarte a resolverlo. ¡Gracias! ",http://play.google.com/console/developers/4990580764130084460/app/4975284850460070403/user-feedback/review-details?reviewId=047df2b7-a468-4206-b324-c381231981cd&corpus=PUBLIC_REVIEWS
com.axionenergy.on,300,3,es,dubai,2023-05-10T18:30:58Z,1.68374E+12,2023-05-10T18:30:58Z,1.68374E+12,3,,Estaría bueno que memorize usuario y contraseña,2023-05-11T19:19:13Z,1.68383E+12,"Hola Martín Allevato, agradecemos tu mensaje, estamos trabajando en mejorar la experiencia de usuario en nuestra app, próximamente tendremos el reconocimiento facial para el ingreso.Tendremos en cuenta tu comentario y esperamos que nos sigas acompañando. ¡Gracias!",http://play.google.com/console/developers/4990580764130084460/app/4975284850460070403/user-feedback/review-details?reviewId=83dd0af3-11f9-4f74-a3d8-9b968cacd2bd&corpus=PUBLIC_REVIEWS
com.axionenergy.on,300,3,es,y2s,2023-05-10T20:25:38Z,1.68375E+12,2023-05-10T20:25:38Z,1.68375E+12,3,,Puede mejorar. Me tuve que bajar del auto para ir a pagar adentro de la estación. Algo que YPF mejoro. Y el acceso debería ser más cómodo por huella digital.,2023-05-11T19:18:34Z,1.68383E+12,"Hola Augusto Gammelgaard, agradecemos tu mensaje, estamos trabajando en mejorar la experiencia de usuario en nuestra app, próximamente tendremos el reconocimiento facial para el ingreso.Tendremos en cuenta tus comentarios y esperamos que nos sigas acompañando. ¡Gracias! ",http://play.google.com/console/developers/4990580764130084460/app/4975284850460070403/user-feedback/review-details?reviewId=45f33521-39ea-40c0-8c98-fa82b2c603e4&corpus=PUBLIC_REVIEWS
com.axionenergy.on,,,es,a6plte,2023-05-10T22:29:06Z,1.68376E+12,2023-05-10T22:29:06Z,1.68376E+12,2,,Le pongo 2 estrellas porque no puedo logearme llego hasta donde pongo mi mail y contraseña y no puedo continuar. Me pueden ayudar,2023-05-11T19:17:23Z,1.68383E+12,"Hola Mirian Pereyra, agradecemos tu mensaje, estamos trabajando en mejorar la experiencia de usuario en nuestra app. Por favor llamanos al 0800-888-0282 para ayudarte a resolverlo. ¡Gracias! ",http://play.google.com/console/developers/4990580764130084460/app/4975284850460070403/user-feedback/review-details?reviewId=e3e82f86-3f1b-4fc8-9db4-7e6aa41ca9a9&corpus=PUBLIC_REVIEWS
com.axionenergy.on,300,3,es,odessa,2023-04-19T22:29:41Z,1.68194E+12,2023-05-11T00:10:02Z,1.68376E+12,3,,"Pésima experiencia fui a la Axion situada en Av. Pres. Perón 4531, Villa Tesei, Provincia de Buenos Aires, razón social Exfako... No me aplicaron el 15% de descuento en la primera carga dice que solo aplica los días lunes y jueves, siendo que en la app expresamente dice que aplica el descuento de la primera carga todos los dias",2023-04-21T18:12:42Z,1.6821E+12,"Hola SERGIO ROUGIER, agradecemos tu mensaje, estamos trabajando en mejorar la experiencia de usuario en nuestra app. Por favor llamanos al 0800-888-0282 para poder ayudarte. ¡Gracias! ",http://play.google.com/console/developers/4990580764130084460/app/4975284850460070403/user-feedback/review-details?reviewId=1b54a405-fa4e-43ba-a643-3005f9cae8b1&corpus=PUBLIC_REVIEWS
com.axionenergy.on,300,3,es,nicklaus_f,2023-05-11T00:51:12Z,1.68377E+12,2023-05-11T00:51:12Z,1.68377E+12,1,,No me deja creas usuario.... Nunk para al paso 2.... Ya la desinstale y la volví a descargar y me hace lo mismo,2023-05-11T19:12:37Z,1.68383E+12,"Hola ROMAN VERGARA, agradecemos tu mensaje, estamos trabajando en mejorar la experiencia de usuario en nuestra app. Por favor llamanos al 0800-888-0282 para ayudarte a resolverlo. ¡Gracias! ",http://play.google.com/console/developers/4990580764130084460/app/4975284850460070403/user-feedback/review-details?reviewId=1557a273-1556-4374-bc8a-d3bd97c3c298&corpus=PUBLIC_REVIEWS
com.axionenergy.on,300,3,es,meh35lm,2023-05-11T11:48:00Z,1.68381E+12,2023-05-11T11:48:00Z,1.68381E+12,2,,No me anda que pasa con on axón,2023-05-11T19:12:05Z,1.68383E+12,"Hola Orlando González, agradecemos tu mensaje, estamos trabajando en mejorar la experiencia de usuario en nuestra app. Ante cualquier consulta, no dudes en llamarnos al 0800-888-0282 para poder ayudarte. ¡Gracias! ",http://play.google.com/console/developers/4990580764130084460/app/4975284850460070403/user-feedback/review-details?reviewId=9b785c35-bc4e-496d-a267-bcab5c60981d&corpus=PUBLIC_REVIEWS
com.axionenergy.on,300,3,es,spes,2023-05-11T12:44:39Z,1.68381E+12,2023-05-11T12:44:39Z,1.68381E+12,5,,"La aplicación mejoro muchísimo. Y tiene muy buenas promociones. Lamentablemente te pide que inicies sesión constantemente cada vez que lo abrís, es muy molesto. Sigan mejorando.",2023-05-11T19:11:24Z,1.68383E+12,"Hola Lucas Hevia, agradecemos tu mensaje, estamos trabajando en mejorar la experiencia de usuario en nuestra app, próximamente tendremos el reconocimiento facial para el ingreso. ¡Gracias por elegirnos! ",http://play.google.com/console/developers/4990580764130084460/app/4975284850460070403/user-feedback/review-details?reviewId=d046563a-0e67-4ab3-babd-526c28adfb06&corpus=PUBLIC_REVIEWS
com.axionenergy.on,300,3,es,miami,2023-05-12T02:39:37Z,1.68386E+12,2023-05-12T02:39:37Z,1.68386E+12,1,,,,,,
com.axionenergy.on,300,3,en,OnePlus7Pro,2023-05-12T03:50:32Z,1.68386E+12,2023-05-12T03:50:32Z,1.68386E+12,3,,,,,,
com.axionenergy.on,,,es,river,2023-05-12T22:06:09Z,1.68393E+12,2023-05-12T22:06:09Z,1.68393E+12,1,,"Puse una estrella para que me permita opinar. No me deja crear la cuenta. Llegó al final y me dice Ups, hubo un error. La desinstalé, la volví a instalar y nada. No me deja crear la cuenta. Saludos",2023-05-18T21:03:17Z,1.68444E+12,"Hola Marcela Martignago, agradecemos tu mensaje, estamos trabajando en mejorar la experiencia de usuario en nuestra app. Por favor llamanos al 0800-888-0282 para ayudarte con tu registro. ¡Gracias! ",http://play.google.com/console/developers/4990580764130084460/app/4975284850460070403/user-feedback/review-details?reviewId=57ced46a-fb4b-44f1-a935-8784ec2e53cb&corpus=PUBLIC_REVIEWS
com.axionenergy.on,300,3,es,G8142,2023-05-12T23:03:11Z,1.68393E+12,2023-05-12T23:03:11Z,1.68393E+12,1,,No podes cargar los datos para dar alta la cuenta. El pase de página no tiene el avance. Y lo probamos vs.,2023-05-18T21:12:22Z,1.68444E+12,"Hola Fabiana V. Vidal, agradecemos tu mensaje, estamos trabajando en mejorar la experiencia de usuario en nuestra app. Por favor llamanos al 0800-888-0282 para ayudarte con tu registro. ¡Gracias!",http://play.google.com/console/developers/4990580764130084460/app/4975284850460070403/user-feedback/review-details?reviewId=5591e363-833e-4d98-939f-c5d5070d48bb&corpus=PUBLIC_REVIEWS
com.axionenergy.on,300,3,es,cebu,2023-05-12T23:10:29Z,1.68393E+12,2023-05-12T23:10:29Z,1.68393E+12,1,,"ENGAÑOSA! 15% de descuento en la 1ra carga, TOPE DE REINTEGRO $600. Llené el tanque y el descuento terminó siendo un lastimoso 7%",2023-05-18T21:16:32Z,1.68444E+12,"Hola Gonzalo,agradecemos tu mensaje,estamos trabajando en mejorar la experiencia de usuario en nuestra app. El descuento de Bienvenida es del 15% para nafta o diésel con tope de $600 según lo indicamos en los términos y condiciones,pero el tope del descuento de la 5ta Carga depende del promedio de tus cargas y del nivel dónde te encuentres.Gracias ",http://play.google.com/console/developers/4990580764130084460/app/4975284850460070403/user-feedback/review-details?reviewId=ab21c148-8216-4bd5-99b8-c44f091d6de8&corpus=PUBLIC_REVIEWS
com.axionenergy.on,300,3,es,a30,2023-05-12T23:49:15Z,1.68394E+12,2023-05-12T23:54:29Z,1.68394E+12,1,,"Mala, lenta e inutil la app. Pensé que era para gestionar pagos y no. Le di otra oportunidad y nada. Inutil. Activé el gps, igual tuve que buscar las estaciones a mano. Por ej. Se que hay una estación que está adherida y no aparece. Registro y logueo, debe haber hecho un programador con pocas luces o no le pagaron.",2023-05-18T21:17:39Z,1.68444E+12,"Hola Gabriel G, agradecemos tu mensaje, estamos trabajando en mejorar la experiencia de usuario en nuestra app. Tendremos en cuenta tu comentario. ¡Gracias! ",http://play.google.com/console/developers/4990580764130084460/app/4975284850460070403/user-feedback/review-details?reviewId=34760809-d8b0-4eff-8a61-0af6bd654bfa&corpus=PUBLIC_REVIEWS
com.axionenergy.on,300,3,es,a03s,2023-05-13T00:53:19Z,1.68394E+12,2023-05-13T00:53:19Z,1.68394E+12,5,,,,,,
com.axionenergy.on,300,3,es,vayu,2023-05-13T13:42:17Z,1.68399E+12,2023-05-13T13:42:17Z,1.68399E+12,1,,Arreglen la app. No funciona bien. Hay que cambiar la contraseña todos los días. Agreguen la posibilidad de ingresar con huella dactilar.,2023-05-18T21:19:11Z,1.68444E+12,"Hola Max Martin, agradecemos tu mensaje, estamos trabajando en mejorar la experiencia de usuario en nuestra app, próximamente incorporaremos el reconocimiento facial. Por favor llamanos al 0800-888-0282 para ayudarte. ¡Gracias!",http://play.google.com/console/developers/4990580764130084460/app/4975284850460070403/user-feedback/review-details?reviewId=8058ea63-76ed-4f86-be62-7f883c5e8eec&corpus=PUBLIC_REVIEWS
com.axionenergy.on,300,3,es,corfu,2023-05-13T15:41:25Z,1.68399E+12,2023-05-13T15:42:02Z,1.68399E+12,3,,Tienen que mejorar los códigos de descuento hagan que salga un QR POR QUE LO PLAYERO LO TIENEN QUE COLOCAR MANUAL LOS 18 DIGITOS GRACIAS . ESPERO ESE CAMBIO Y COLOQUEN QUE NO SE CIERRE LA APP ASI UNO NO TIENE QUE VOLVER ABRIR CADA RATO,2023-05-18T21:21:55Z,1.68444E+12,"Hola Camilo Chabeldin, agradecemos tu mensaje, estamos trabajando en mejorar la experiencia de usuario en nuestra app, próximamente tendremos el reconocimiento facial para el ingreso. En cuanto al canje o uso de los cupones, por favor llamanos al 0800-888-0282 para ayudarte a resolverlo. ¡Gracias! ",http://play.google.com/console/developers/4990580764130084460/app/4975284850460070403/user-feedback/review-details?reviewId=cd0efd8d-2886-49cd-ab5d-deac43acdf08&corpus=PUBLIC_REVIEWS
com.axionenergy.on,300,3,es,maltalsc,2023-05-13T18:59:47Z,1.684E+12,2023-05-13T18:59:47Z,1.684E+12,5,,,,,,
com.axionenergy.on,,,es,merlin,2023-05-13T21:07:05Z,1.68401E+12,2023-05-13T21:07:05Z,1.68401E+12,5,,,,,,
com.axionenergy.on,300,3,es,a04,2023-05-14T04:48:16Z,1.68404E+12,2023-05-14T04:48:16Z,1.68404E+12,3,,,,,,
com.axionenergy.on,300,3,es,a21s,2023-05-14T13:33:01Z,1.68407E+12,2023-05-14T13:33:01Z,1.68407E+12,5,,Lograré alcanzar niveles y probar esta nueva experiencia en AXION,2023-05-18T21:23:51Z,1.68445E+12,"Hola Maryela Martinez, gracias por tu mensaje, qué bueno que te gusto nuestra app, hay muchos beneficios y están geolocalizados para que puedas disfrutarlos dependiendo en qué parte del país te encuentres. ¡Gracias! ",http://play.google.com/console/developers/4990580764130084460/app/4975284850460070403/user-feedback/review-details?reviewId=c1c42134-a79a-4d93-85d0-ecfa2d3eaef9&corpus=PUBLIC_REVIEWS
com.axionenergy.on,300,3,es,Armor_X7_Pro,2023-05-14T15:21:57Z,1.68408E+12,2023-05-14T15:21:57Z,1.68408E+12,1,,,,,,
com.axionenergy.on,,,es,a30,2023-05-14T21:54:52Z,1.6841E+12,2023-05-14T21:54:52Z,1.6841E+12,2,,,,,,
com.axionenergy.on,300,3,es,a33x,2023-05-14T22:32:48Z,1.6841E+12,2023-05-14T22:32:48Z,1.6841E+12,2,,Hagan manual para colocar fecha de nacimiento...me volveré mono si retrocedo...no me deja avanzar p crear cuenta...soy del 77🤣,2023-05-18T21:29:46Z,1.68445E+12,"Hola mar vi, agradecemos tu mensaje, estamos trabajando en mejorar la experiencia de usuario en nuestra app. Respecto a la fecha de nacimiento, podés hacer clic en el año y seleccionar el año de tu nacimiento sin tener que ir para atrás mes por mes. Por favor comunicate con nosotros al 0800-888-0282 para poder ayudarte con tu registro. ¡Gracias!",http://play.google.com/console/developers/4990580764130084460/app/4975284850460070403/user-feedback/review-details?reviewId=924d2839-ff18-4ef7-bab5-dc093b0a9835&corpus=PUBLIC_REVIEWS
com.axionenergy.on,300,3,es,beyond0,2023-05-15T06:09:12Z,1.68413E+12,2023-05-15T06:09:12Z,1.68413E+12,3,,"Para los que le rebota la contraseña tienen que poner la correcta 3 o 4 veces, al inicio parece que la app se abre varias veces y hay que poner la contraseña hasta que entre.",2023-05-18T21:33:34Z,1.68445E+12,"Hola Veppo Tóxico, agradecemos tu mensaje, estamos trabajando en mejorar la experiencia de usuario en nuestra app. Por cualquier cosa podes comunicarte con nosotros al 0800-888-0282. ¡Muchas gracias por tus comentarios! ",http://play.google.com/console/developers/4990580764130084460/app/4975284850460070403/user-feedback/review-details?reviewId=0d3f91dd-505e-4101-91aa-659aad7f5545&corpus=PUBLIC_REVIEWS
